{
  "id": "SERIES",
  "title": "에테르노의 그림자",
  "premise": "전쟁 영웅이었으나 왼팔을 잃고 몰락한 검사 '카엘'과 그의 여동생 '리아'가 전대 왕의 죽음에 숨겨진 추악한 진실을 추적한다. 숨겨진 왕가의 혈통인 남매는 왕이 남긴 5개의 '영혼의 조각'을 모아 섭정 발타자르의 음모를 밝히고 제국을 되찾으려 한다.",
  "theme": "상실을 통한 성장과 정당한 권위의 회복",
  "ending": "발타자르의 가짜 권능을 파괴하고 제국의 감시망을 무너뜨려 진정한 여명을 불러온다.",
  "volume_ids": [
    "V1",
    "V2",
    "V3",
    "V4",
    "V5"
  ],
  "elements": [
    {
      "id": "EL-01",
      "kind": "setup",
      "description": "카엘이 기사단에서 익힌 심박 통제 호흡법"
    },
    {
      "id": "EL-02",
      "kind": "setup",
      "description": "제국 정예병의 기하학적 마력 방패"
    },
    {
      "id": "EL-03",
      "kind": "setup",
      "description": "왼팔의 부재로 인한 신체적 불균형"
    },
    {
      "id": "EL-04",
      "kind": "payoff",
      "description": "불균형을 이용한 변칙 검술로 마력 방패 돌파",
      "resolves": "EL-02"
    },
    {
      "id": "EL-05",
      "kind": "payoff",
      "description": "호흡법을 이용한 궁전 잠입",
      "resolves": "EL-01"
    },
    {
      "id": "EL-06",
      "kind": "change",
      "description": "방계 혈통에서 제국의 정당한 계승자로의 자각"
    }
  ]
}
